{
  "schemaVersion": 2,
  "patchID": "pcvr-parallel-pc-55638e9-vrc-2026.2.30300-1365-macos-25g70",
  "supportState": "experimental",
  "architecture": "arm64",
  "playCover": {
    "repository": "https://github.com/PlayCover/PlayCover.git",
    "commit": "55638e98f36eac1f3d09803799480e9d83f663f8",
    "bundleIdentifier": "io.playcover.PlayCover",
    "shortVersion": "3.1.0",
    "buildVersion": "856",
    "executableName": "PlayCover",
    "executableSHA256": "82c73cc8ecdad4e1b5f47696413613f9d223bcb57833f1ae6a6145642cd6c8a7",
    "executableUUID": "BEA1F86C-247B-3C5A-80F4-9C028ED04240",
    "treeSHA256": "9a2780df76622d6f4bb9b2f0c215c2c0dd85b0424654e1f0ea00c9e454ac15f5",
    "infoPlistSHA256": "e3ddbac0036eaead5fd27676c4d398b707817f4799645598f095cf1dee77c70f",
    "codeResourcesSHA256": "234697cef7973b4059bc6c9303dfec3f0fdd40b77a3f930d1a3c6f9fd352e7ce"
  },
  "layout": {
    "originalAppPath": "/Applications/PlayCover.app",
    "patchedAppPath": "/Applications/PlayCover VRChat.app",
    "originalLibraryRelativePath": "Library/Containers/io.playcover.PlayCover",
    "patchedLibraryRelativePath": "Library/Containers/io.github.northstarxyzz.PlayCoverVRChat",
    "sharedVRChatContainerRelativePath": "Library/Containers/com.vrchat.mobile"
  },
  "host": {
    "productVersion": "26.6",
    "buildVersion": "25G70",
    "xnuVersion": "xnu-12377.161.13~4"
  },
  "policy": {
    "defaultMode": "automatic75Percent",
    "minimumGiB": 4,
    "maximumPhysicalMemoryPercent": 75,
    "stepGiB": 1,
    "waitSeconds": 300,
    "fatal": false
  },
  "ipc": {
    "protocolVersion": 2,
    "socketPath": "/private/var/run/io.github.northstarxyzz.pcvrpatcher/session.sock"
  }
}
